<?xml version="1.0" encoding="UTF-8"?>
<!-- edited with XMLSPY v2004 rel. 3 U (http://www.xmlspy.com) by Rebecca Y Jordan (UNIV OF SOUTHERN CALIF) -->
<!--Sample XML file generated by XMLSPY v2004 rel. 3 U (http://www.xmlspy.com)-->
<adag xmlns="http://pegasus.isi.edu/schema/DAX" xmlns:xsi="http://www.w3.org/2001/XMLSchema-instance" xsi:schemaLocation="http://pegasus.isi.edu/schema/DAX
C:\DOCUME~1\voeckler\Desktop\schema\dax-3.2\dax-3.2.xsd" version="0.0.0" name="-" index="0" count="1" jobCount="2" fileCount="1" childCount="1">
	<file name="NMTOKEN" link="none" optional="false">
		<profile key="String" namespace="pegasus">Text</profile>
		<profile key="String" namespace="pegasus">Text</profile>
		<metadata key="NMTOKEN" type="NMTOKEN">String</metadata>
		<metadata key="NMTOKEN" type="NMTOKEN">String</metadata>
		<pfn url="http://www.altova.com" site="local">
			<profile key="String" namespace="pegasus">Text</profile>
			<profile key="String" namespace="pegasus">Text</profile>
		</pfn>
		<pfn url="http://www.altova.com" site="local">
			<profile key="String" namespace="pegasus">Text</profile>
			<profile key="String" namespace="pegasus">Text</profile>
		</pfn>
	</file>
	<file name="NMTOKEN" link="none" optional="false">
		<profile key="String" namespace="pegasus">Text</profile>
		<profile key="String" namespace="pegasus">Text</profile>
		<metadata key="NMTOKEN" type="NMTOKEN">String</metadata>
		<metadata key="NMTOKEN" type="NMTOKEN">String</metadata>
		<pfn url="http://www.altova.com" site="local">
			<profile key="String" namespace="pegasus">Text</profile>
			<profile key="String" namespace="pegasus">Text</profile>
		</pfn>
		<pfn url="http://www.altova.com" site="local">
			<profile key="String" namespace="pegasus">Text</profile>
			<profile key="String" namespace="pegasus">Text</profile>
		</pfn>
	</file>
	<executable name="NMTOKEN" namespace="String" version="0.0.0" arch="x86" os="LINUX" osrelease="String" osversion="0.0.0" glibc="0.0.0">
		<profile key="String" namespace="pegasus">Text</profile>
		<profile key="String" namespace="pegasus">Text</profile>
		<metadata key="NMTOKEN" type="NMTOKEN">String</metadata>
		<metadata key="NMTOKEN" type="NMTOKEN">String</metadata>
		<pfn url="http://www.altova.com" site="local">
			<profile key="String" namespace="pegasus">Text</profile>
			<profile key="String" namespace="pegasus">Text</profile>
		</pfn>
		<pfn url="http://www.altova.com" site="local">
			<profile key="String" namespace="pegasus">Text</profile>
			<profile key="String" namespace="pegasus">Text</profile>
		</pfn>
	</executable>
	<executable name="NMTOKEN" namespace="String" version="0.0.0" arch="x86" os="LINUX" osrelease="String" osversion="0.0.0" glibc="0.0.0">
		<profile key="String" namespace="pegasus">Text</profile>
		<profile key="String" namespace="pegasus">Text</profile>
		<metadata key="NMTOKEN" type="NMTOKEN">String</metadata>
		<metadata key="NMTOKEN" type="NMTOKEN">String</metadata>
		<pfn url="http://www.altova.com" site="local">
			<profile key="String" namespace="pegasus">Text</profile>
			<profile key="String" namespace="pegasus">Text</profile>
		</pfn>
		<pfn url="http://www.altova.com" site="local">
			<profile key="String" namespace="pegasus">Text</profile>
			<profile key="String" namespace="pegasus">Text</profile>
		</pfn>
	</executable>
	<transformation namespace="String" name="NMTOKEN" version="0.0.0">
		<uses name="String" link="none" optional="false" register="true" transfer="true" namespace="String" version="0.0.0" type="executable"/>
		<uses name="String" link="none" optional="false" register="true" transfer="true" namespace="String" version="0.0.0" type="executable"/>
	</transformation>
	<transformation namespace="String" name="NMTOKEN" version="0.0.0">
		<uses name="String" link="none" optional="false" register="true" transfer="true" namespace="String" version="0.0.0" type="executable"/>
		<uses name="String" link="none" optional="false" register="true" transfer="true" namespace="String" version="0.0.0" type="executable"/>
	</transformation>
	<job name="NMTOKEN" id="-" node-label="String" namespace="String" version="0.0.0">
		<argument>Text<file name="String"/>
			<file name="String"/>
		</argument>
		<profile key="String" namespace="pegasus">Text</profile>
		<profile key="String" namespace="pegasus">Text</profile>
		<stdin name="String" link="input"/>
		<stdout name="String" link="output"/>
		<stderr name="String" link="output"/>
		<uses name="String" link="none" optional="false" register="true" transfer="true" namespace="String" version="0.0.0" type="file"/>
		<uses name="String" link="none" optional="false" register="true" transfer="true" namespace="String" version="0.0.0" type="file"/>
		<invoke when="never"/>
		<invoke when="never"/>
	</job>
	<job name="NMTOKEN" id="-" node-label="String" namespace="String" version="0.0.0">
		<argument>Text<file name="String"/>
			<file name="String"/>
		</argument>
		<profile key="String" namespace="pegasus">Text</profile>
		<profile key="String" namespace="pegasus">Text</profile>
		<stdin name="String" link="input"/>
		<stdout name="String" link="output"/>
		<stderr name="String" link="output"/>
		<uses name="String" link="none" optional="false" register="true" transfer="true" namespace="String" version="0.0.0" type="file"/>
		<uses name="String" link="none" optional="false" register="true" transfer="true" namespace="String" version="0.0.0" type="file"/>
		<invoke when="never"/>
		<invoke when="never"/>
	</job>
	<child ref="-">
		<parent ref="-" edge-label="String"/>
		<parent ref="-" edge-label="String"/>
	</child>
	<child ref="-">
		<parent ref="-" edge-label="String"/>
		<parent ref="-" edge-label="String"/>
	</child>
</adag>
